{
  "schema_version": 1,
  "record_id": "open-mmi.vehicle-profile-qualification",
  "profile_id": "brand-model-generation-platform",
  "current": {
    "level": "none",
    "tested_on": null,
    "scope": [],
    "compatibility": {
      "equipment": [],
      "variants": []
    },
    "review": {
      "status": "unreviewed",
      "reviewers": [],
      "reviewed_on": null,
      "recheck_after": null
    }
  },
  "history": []
}
